{
  "version": "2.0.1",
  "league": "La Liga",
  "week": 5,
  "shortlist": {
    "high_confidence": [
      {
        "Week": 5,
        "Match": "Real Madrid vs Valencia CF",
        "TopPick": "Home Win",
        "Confidence": 0.73,
        "Risk": 0.27,
        "H": 0.73,
        "D": 0.15,
        "A": 0.11,
        "blend_alpha": 0.53
      },
      {
        "Week": 5,
        "Match": "Barcelona vs CA Osasuna",
        "TopPick": "Home Win",
        "Confidence": 0.71,
        "Risk": 0.29,
        "H": 0.71,
        "D": 0.17,
        "A": 0.13,
        "blend_alpha": 0.46
      },
      {
        "Week": 5,
        "Match": "Athletic Club vs Girona FC",
        "TopPick": "Home Win",
        "Confidence": 0.7,
        "Risk": 0.3,
        "H": 0.7,
        "D": 0.18,
        "A": 0.12,
        "blend_alpha": 0.52
      }
    ],
    "medium_confidence": [
      {
        "Week": 5,
        "Match": "Atl√©tico de Madrid vs Real Betis",
        "TopPick": "Home Win",
        "Confidence": 0.58,
        "Risk": 0.42,
        "H": 0.58,
        "D": 0.22,
        "A": 0.2,
        "blend_alpha": 0.49
      },
      {
        "Week": 5,
        "Match": "Villarreal CF vs Getafe CF",
        "TopPick": "Home Win",
        "Confidence": 0.51,
        "Risk": 0.49,
        "H": 0.51,
        "D": 0.25,
        "A": 0.24,
        "blend_alpha": 0.5
      }
    ],
    "low_confidence": [
      {
        "Week": 5,
        "Match": "Levante UD vs Real Oviedo",
        "TopPick": "Home Win",
        "Confidence": 0.43,
        "Risk": 0.57,
        "H": 0.43,
        "D": 0.25,
        "A": 0.32,
        "blend_alpha": 0.5
      },
      {
        "Week": 5,
        "Match": "RCD Mallorca vs Elche CF",
        "TopPick": "Away Win",
        "Confidence": 0.41,
        "Risk": 0.59,
        "H": 0.32,
        "D": 0.27,
        "A": 0.41,
        "blend_alpha": 0.5
      }
    ]
  },
  "upset_candidates": []
}